{
  "camera": {
    "angle": 0,
    "vAngle": 0
  },
  "quality": "hires",
  "stage": "default",
  "structure": {
    "outer_wall_left": {
      "sku": "102.105.00"
    },
    "outer_wall_right": {
      "sku": "102.105.00"
    },
    "columns": [
      {
        "corpus": {
          "sku": "401.100.04"
        },
        "boards": [
          {
            "sku": "102.103.00",
            "z": 38.3
          },
          {
            "z": 76.7,
            "sku": "102.103.00"
          },
          {
            "z": 153.5,
            "sku": "102.103.00"
          }
        ],
        "doors": [
          {
            "door": {
              "sku": "102.107.08"
            },
            "handles": [
              {
                "sku": "102.108.00"
              },
              {
                "sku": "102.108.02"
              }
            ]
          }
        ],
        "backwall": {
          "sku": "000.002.08"
        },
        "drawers": [
          {
            "sku": "401.100.164",
            "z": 147
          }
        ],
        "cluster": 0
      },
      {
        "corpus": {
          "sku": "401.100.04"
        },
        "boards": [
          {
            "sku": "102.103.00",
            "z": 38.3
          },
          {
            "z": 76.7,
            "sku": "102.103.00"
          }
        ],
        "doors": [
          {
            "door": {
              "sku": "102.107.00"
            },
            "handles": [
              {
                "sku": "102.108.00"
              },
              {
                "sku": "102.108.00"
              }
            ]
          }
        ],
        "backwall": {
          "sku": "000.002.08"
        },
        "drawers": [
          {
            "sku": "401.100.134",
            "z": 3
          },
          {
            "sku": "401.100.134",
            "z": 22.2
          },
          {
            "sku": "401.100.134",
            "z": 41.4
          },
          {
            "sku": "401.100.134",
            "z": 60.6
          },
          {
            "sku": "401.100.126",
            "z": 79.8
          }
        ],
        "lifts": [
          {
            "sku": "401.100.117",
            "z": 213.5
          }
        ],
        "cluster": 0
      },
      {
        "corpus": {
          "sku": "401.100.04"
        },
        "boards": [
          {
            "sku": "102.103.00",
            "z": 38.3
          },
          {
            "z": 76.7,
            "sku": "102.103.00"
          },
          {
            "z": 115.1,
            "sku": "102.103.00"
          },
          {
            "z": 153.5,
            "sku": "102.103.00"
          },
          {
            "z": 191.9,
            "sku": "102.103.00"
          }
        ],
        "doors": [
          {
            "door": {
              "sku": "102.107.08"
            },
            "handles": [
              {
                "sku": "102.108.00"
              },
              {
                "sku": "102.108.00"
              }
            ]
          }
        ],
        "backwall": {
          "sku": "000.002.08"
        },
        "drawers": [
          {
            "sku": "401.100.147",
            "z": 41.4
          },
          {
            "sku": "401.100.147",
            "z": 60.6
          },
          {
            "sku": "401.100.147",
            "z": 79.8
          }
        ],
        "cluster": 0
      },
      {
        "corpus": {
          "sku": "401.100.05"
        },
        "boards": [
          {
            "sku": "102.103.00",
            "z": 38.3
          },
          {
            "z": 153.5,
            "sku": "102.103.00"
          },
          {
            "z": 191.9,
            "sku": "102.103.00"
          }
        ],
        "doors": [
          {
            "door": {
              "sku": "102.107.00"
            },
            "handles": [
              {
                "sku": "401.100.104"
              },
              {
                "sku": "401.100.104"
              }
            ]
          }
        ],
        "cloth_rails": [
          {
            "sku": "102.119.01",
            "z": 148.4
          }
        ],
        "backwall": {
          "sku": "000.002.02"
        },
        "cluster": 1
      },
      {
        "corpus": {
          "sku": "401.100.04"
        },
        "boards": [
          {
            "sku": "102.103.00",
            "z": 38.3
          },
          {
            "z": 76.7,
            "sku": "102.103.00"
          },
          {
            "z": 115.1,
            "sku": "102.103.00"
          },
          {
            "z": 153.5,
            "sku": "102.103.00"
          },
          {
            "z": 191.9,
            "sku": "102.103.00"
          }
        ],
        "doors": [
          {
            "door": {
              "sku": "102.107.00"
            },
            "handles": [
              {
                "sku": "401.100.104"
              },
              {
                "sku": "401.100.104"
              }
            ]
          }
        ],
        "backwall": {
          "sku": "000.002.08"
        },
        "cluster": 1
      }
    ]
  }
}